{
  "artifact_bindings": {
    "assurance_bundle": {
      "artifact": "assurance_bundle",
      "artifact_hash": "c6172be428a35a27cf1c67b05535bbad343bddb4a045175124a3cc1061819c29",
      "hash_reproducible": true,
      "level": "",
      "payload_hash": "c6172be428a35a27cf1c67b05535bbad343bddb4a045175124a3cc1061819c29",
      "present": true,
      "status": ""
    },
    "certification_attestation": {
      "artifact": "certification_attestation",
      "artifact_hash": "7af5cece554505454b92a50082d9035d011d1075eceab8f5790403348c74a6e0",
      "hash_reproducible": true,
      "level": "RDLLM-L52",
      "payload_hash": "7af5cece554505454b92a50082d9035d011d1075eceab8f5790403348c74a6e0",
      "present": true,
      "status": "attested"
    },
    "certification_report": {
      "artifact": "certification_report",
      "artifact_hash": "88b4d4d1009bb970ca7e7a0b767768809f4decee03adf0d848852918e760651a",
      "hash_reproducible": true,
      "level": "RDLLM-L186",
      "payload_hash": "88b4d4d1009bb970ca7e7a0b767768809f4decee03adf0d848852918e760651a",
      "present": true,
      "status": "passed"
    },
    "discovery_manifest": {
      "artifact": "discovery_manifest",
      "artifact_hash": "089f6bcc1854e6032f63faed3cff29e32272cba747f089b5aacae71f67889e61",
      "hash_reproducible": true,
      "level": "RDLLM-L186",
      "payload_hash": "089f6bcc1854e6032f63faed3cff29e32272cba747f089b5aacae71f67889e61",
      "present": true,
      "status": "ready"
    },
    "finance_ledger_attestation": {
      "artifact": "finance_ledger_attestation",
      "artifact_hash": "bf9213efed842b864f119fc30fcfd464e6f4df7ce8845bfe2677530d7d973ef0",
      "hash_reproducible": true,
      "level": "RDLLM-L47",
      "payload_hash": "bf9213efed842b864f119fc30fcfd464e6f4df7ce8845bfe2677530d7d973ef0",
      "present": true,
      "status": "ready"
    },
    "integration_profile": {
      "artifact": "integration_profile",
      "artifact_hash": "5c2c2e5a3a9672c9c9f54cd4184d0f6abe8d5ade50e539efe762affb45b35b40",
      "hash_reproducible": true,
      "level": "RDLLM-L21",
      "payload_hash": "5c2c2e5a3a9672c9c9f54cd4184d0f6abe8d5ade50e539efe762affb45b35b40",
      "present": true,
      "status": "ready"
    },
    "proof_dependency_graph": {
      "artifact": "proof_dependency_graph",
      "artifact_hash": "d5afe72a4436c8196a4c892cac321f6b3c98ff0a38e51682f151d6790dc0f1f8",
      "hash_reproducible": true,
      "level": "RDLLM-L186",
      "payload_hash": "d5afe72a4436c8196a4c892cac321f6b3c98ff0a38e51682f151d6790dc0f1f8",
      "present": true,
      "status": "ready"
    },
    "provider_attribution_card": {
      "artifact": "provider_attribution_card",
      "artifact_hash": "facad8d425e0bb312b6736d4351f321fcfd3643584f09b37dec4ee2b2c83ec51",
      "hash_reproducible": true,
      "level": "RDLLM-L186",
      "payload_hash": "facad8d425e0bb312b6736d4351f321fcfd3643584f09b37dec4ee2b2c83ec51",
      "present": true,
      "status": ""
    },
    "response_envelope": {
      "artifact": "response_envelope",
      "artifact_hash": "1bc14c301e297d81bc848a5682a4921c8d5e372096d7a0297d9994eeaa5fddeb",
      "hash_reproducible": true,
      "level": "RDLLM-L186",
      "payload_hash": "1bc14c301e297d81bc848a5682a4921c8d5e372096d7a0297d9994eeaa5fddeb",
      "present": true,
      "status": "verified"
    },
    "revenue_allocation_report": {
      "artifact": "revenue_allocation_report",
      "artifact_hash": "d927e86b83c754197b4c9f28cf00828bff8b29289e9b5a0cc49d7604761d1cd3",
      "hash_reproducible": true,
      "level": "RDLLM-L46",
      "payload_hash": "d927e86b83c754197b4c9f28cf00828bff8b29289e9b5a0cc49d7604761d1cd3",
      "present": true,
      "status": "ready"
    },
    "source_footer_delivery": {
      "artifact": "source_footer_delivery",
      "artifact_hash": "c28f21b660abb03c6ad338dacd9f8ec81b3959baa675df829034c28260789f6d",
      "hash_reproducible": true,
      "level": "RDLLM-L103",
      "payload_hash": "c28f21b660abb03c6ad338dacd9f8ec81b3959baa675df829034c28260789f6d",
      "present": true,
      "status": "ready"
    },
    "trust_registry": {
      "artifact": "trust_registry",
      "artifact_hash": "ca4bf6639b80b98dd0dffcf7b67855a0a9717e22ceca6576df57e0c029346974",
      "hash_reproducible": true,
      "level": "RDLLM-L51",
      "payload_hash": "ca4bf6639b80b98dd0dffcf7b67855a0a9717e22ceca6576df57e0c029346974",
      "present": true,
      "status": "ready"
    },
    "universal_foundation_provider_adoption_pack": {
      "artifact": "universal_foundation_provider_adoption_pack",
      "artifact_hash": "233dda7cff0b2f547cda87e4824c672c0d5d9da864551c856962e3b774a37c79",
      "hash_reproducible": true,
      "level": "RDLLM-L162",
      "payload_hash": "233dda7cff0b2f547cda87e4824c672c0d5d9da864551c856962e3b774a37c79",
      "present": true,
      "status": "ready"
    },
    "universal_industry_adoption_root": {
      "artifact": "universal_industry_adoption_root",
      "artifact_hash": "ccca5981da6b7fa25f23b3936d79ac1e4f3eb45983346fdc8bb209ad7183837f",
      "hash_reproducible": true,
      "level": "RDLLM-L163",
      "payload_hash": "ccca5981da6b7fa25f23b3936d79ac1e4f3eb45983346fdc8bb209ad7183837f",
      "present": true,
      "status": "ready"
    }
  },
  "checks": {
    "adoption_pack_l162_ready": true,
    "all_distribution_components_installable": true,
    "all_install_targets_fail_closed": true,
    "core_artifacts_bound": true,
    "core_artifacts_ready": true,
    "industry_root_binds_l162_adoption_pack": true,
    "industry_root_l163_ready": true,
    "industry_root_well_known_valid": true,
    "negative_distribution_fixtures_reject": true,
    "private_fields_absent": true,
    "private_strings_absent": true,
    "reference_distribution_signed": true,
    "sbom_and_slsa_provenance_available": true,
    "transparency_log_entries_available": true
  },
  "created_at": "2026-06-03T00:00:00Z",
  "distribution_component_rows": {
    "c2pa_assertion_template": {
      "build_recipe_hash": "1a61155b8b9dcb238365bd523baee69d7a2409b44d87bfc80a9d7b2a54f8d2b6",
      "component_hash": "857305e603ea8a52f2604a85fd27d480ebf0a8265856b319c54ad4fe15c3fbe4",
      "fail_closed_default": true,
      "package_hash": "c285875047a5ef7b85d8c48d98c4712d2dc24c6382f5d1747abe5aa59d631a55",
      "private_payloads_excluded": true,
      "public_path_hash": "6a537f6f3a653f28a612978fd2bdce1bc7de810169a3fa7c2d033e6d6f4f5c89",
      "reproducible_build": true,
      "sbom_available": true,
      "sbom_hash": "164eb9fbc6a8d889919126eb5432cccb10d631fd293062e37b7ac6e6836461d3",
      "signature_hash": "cd1f12c521125d3af9d1bb5d20210bcf963f7b7c5fed96ddc42663721c91eca3",
      "signed": true,
      "slsa_provenance_available": true,
      "slsa_provenance_hash": "8be05b0d803aa0bc1fdb4575cbf4b387ce84f13f70d3c96c78159f632845ffd4",
      "transparency_log_entry_hash": "1f80d220e9b9467b2d3b27f134983dc7d6a8677a131d1832365194b58a16f2f9",
      "transparency_logged": true,
      "verifier_available": true,
      "verifier_command_hash": "d6773cada536c7c8feedb96ca8f2e42b757e8b2875f2091e014f1057c55e2a8e",
      "version_hash": "299883e119a65ff01ecf3c54136a4888ace651aa962145dad53731b6bb326661"
    },
    "conformance_ci_workflow": {
      "build_recipe_hash": "b08375e44712a0318c5566c2cae513f92bbc867e71aba8c44802d6cdc8965c94",
      "component_hash": "a2077513cd45f49d7883c9aeef452177d401017ed9c1341a5d87b0b8977d820e",
      "fail_closed_default": true,
      "package_hash": "e9400462ca5876bdf621acbd10d20a41cc8a78e1db19738d9769dfaa682605f5",
      "private_payloads_excluded": true,
      "public_path_hash": "afeb9536bb792ee8cb0a218f16634d6bb9e7ccb3550deca30bf9331f3334fbc4",
      "reproducible_build": true,
      "sbom_available": true,
      "sbom_hash": "534b51b2af15fb61595b61012de8d1f25d6063f438f0658ddbaaa3b4eda4a986",
      "signature_hash": "31ccd1e1296d635ce27c07a635f35136c917be215cfd4fe5d675a7beb012755a",
      "signed": true,
      "slsa_provenance_available": true,
      "slsa_provenance_hash": "ce1d424d7162a6723e73e553d4b4f56177f671289e12cf9454a9483ce2242a95",
      "transparency_log_entry_hash": "7179d32cf7fc345695b3c699ca99bdd92780fbbba66a985b2ea351dc3d120da0",
      "transparency_logged": true,
      "verifier_available": true,
      "verifier_command_hash": "48dfad78bd5c4ae0c848df852dadbee764934aabf095a872ea4b14833b4cd92b",
      "version_hash": "74a8dd9224e655001ad336b3a558b1c9764c83440eaaf5c94db250aff9736bda"
    },
    "http_gateway_middleware": {
      "build_recipe_hash": "ccc7b5da7daa32ce13190f6a0f5e19c66ca4993b6934b8b79289fb26366ef51b",
      "component_hash": "91fb714ff1bd5e1f560241d5475e35bca549787765cc6e5a9093fa1486934e20",
      "fail_closed_default": true,
      "package_hash": "8453622d4df0973824fb55ecce315aceeca525f0932e8199da1b40f0ec297401",
      "private_payloads_excluded": true,
      "public_path_hash": "7c2a53d618ed184996391f218f82ef0216a7eebd531ab4eed7ce2872f241312a",
      "reproducible_build": true,
      "sbom_available": true,
      "sbom_hash": "0a1753def954145bcc95c0ffd8a7c7349519c3e26bbffadcd1be10907a3de0c5",
      "signature_hash": "c4dd1426fd8400d29efc0ff6f3c3da6a0d1f763903c7af0b339dc4ffb5ff3294",
      "signed": true,
      "slsa_provenance_available": true,
      "slsa_provenance_hash": "9b58b264729cf9e9bdbd06d2914cfa7592ecabaa1913e10562b2a64f9f599d30",
      "transparency_log_entry_hash": "c88556c2d46600da8d308969d72805cadc3a8f3e4881c8e51121f8e108d62921",
      "transparency_logged": true,
      "verifier_available": true,
      "verifier_command_hash": "7af079109b7375346dc8d1c5e64dc995a6d7e38c09d90e1a5fb15e70545a4fa3",
      "version_hash": "7c98c8e1728b3f7218e2be4709a4fe46c5b28fcb8f5c6e3140fe1d98d84bf021"
    },
    "mcp_tool_server_adapter": {
      "build_recipe_hash": "55bf79b6a1df0efe949ea13e080c0b861d6d76a45d665b63ebc9d347b998e0aa",
      "component_hash": "002d8ad377205fe23d7b7a765e6974e417eb2998b5d64d47694b0458bb9ed545",
      "fail_closed_default": true,